{
  "schema_version": "1.0.0",
  "session_id": "sess-fixture",
  "frame_id": 42,
  "timestamp_ms": 1400.5,
  "camera_id": "cam0",
  "image_size": [
    1280,
    720
  ],
  "mirror": true,
  "orientation": "landscape",
  "landmark_set": "mediapipe_pose_33",
  "normalized_landmarks": [
    {
      "id": 0,
      "x": 0.5,
      "y": 0.3,
      "z": -0.1,
      "visibility": 0.95,
      "presence": 0.97
    },
    {
      "id": 1,
      "x": 0.5,
      "y": 0.31,
      "z": -0.1,
      "visibility": 0.95,
      "presence": 0.97
    },
    {
      "id": 2,
      "x": 0.5,
      "y": 0.32,
      "z": -0.1,
      "visibility": 0.95,
      "presence": 0.97
    },
    {
      "id": 3,
      "x": 0.5,
      "y": 0.32999999999999996,
      "z": -0.1,
      "visibility": 0.95,
      "presence": 0.97
    },
    {
      "id": 4,
      "x": 0.5,
      "y": 0.33999999999999997,
      "z": -0.1,
      "visibility": 0.95,
      "presence": 0.97
    },
    {
      "id": 5,
      "x": 0.5,
      "y": 0.35,
      "z": -0.1,
      "visibility": 0.95,
      "presence": 0.97
    },
    {
      "id": 6,
      "x": 0.5,
      "y": 0.36,
      "z": -0.1,
      "visibility": 0.95,
      "presence": 0.97
    },
    {
      "id": 7,
      "x": 0.5,
      "y": 0.37,
      "z": -0.1,
      "visibility": 0.95,
      "presence": 0.97
    },
    {
      "id": 8,
      "x": 0.5,
      "y": 0.38,
      "z": -0.1,
      "visibility": 0.95,
      "presence": 0.97
    },
    {
      "id": 9,
      "x": 0.5,
      "y": 0.39,
      "z": -0.1,
      "visibility": 0.95,
      "presence": 0.97
    },
    {
      "id": 10,
      "x": 0.5,
      "y": 0.4,
      "z": -0.1,
      "visibility": 0.95,
      "presence": 0.97
    },
    {
      "id": 11,
      "x": 0.5,
      "y": 0.41,
      "z": -0.1,
      "visibility": 0.95,
      "presence": 0.97
    },
    {
      "id": 12,
      "x": 0.5,
      "y": 0.42,
      "z": -0.1,
      "visibility": 0.95,
      "presence": 0.97
    },
    {
      "id": 13,
      "x": 0.5,
      "y": 0.43,
      "z": -0.1,
      "visibility": 0.95,
      "presence": 0.97
    },
    {
      "id": 14,
      "x": 0.5,
      "y": 0.44,
      "z": -0.1,
      "visibility": 0.95,
      "presence": 0.97
    },
    {
      "id": 15,
      "x": 0.5,
      "y": 0.44999999999999996,
      "z": -0.1,
      "visibility": 0.95,
      "presence": 0.97
    },
    {
      "id": 16,
      "x": 0.5,
      "y": 0.45999999999999996,
      "z": -0.1,
      "visibility": 0.95,
      "presence": 0.97
    },
    {
      "id": 17,
      "x": 0.5,
      "y": 0.47,
      "z": -0.1,
      "visibility": 0.95,
      "presence": 0.97
    },
    {
      "id": 18,
      "x": 0.5,
      "y": 0.48,
      "z": -0.1,
      "visibility": 0.95,
      "presence": 0.97
    },
    {
      "id": 19,
      "x": 0.5,
      "y": 0.49,
      "z": -0.1,
      "visibility": 0.95,
      "presence": 0.97
    },
    {
      "id": 20,
      "x": 0.5,
      "y": 0.5,
      "z": -0.1,
      "visibility": 0.95,
      "presence": 0.97
    },
    {
      "id": 21,
      "x": 0.5,
      "y": 0.51,
      "z": -0.1,
      "visibility": 0.95,
      "presence": 0.97
    },
    {
      "id": 22,
      "x": 0.5,
      "y": 0.52,
      "z": -0.1,
      "visibility": 0.95,
      "presence": 0.97
    },
    {
      "id": 23,
      "x": 0.5,
      "y": 0.53,
      "z": -0.1,
      "visibility": 0.95,
      "presence": 0.97
    },
    {
      "id": 24,
      "x": 0.5,
      "y": 0.54,
      "z": -0.1,
      "visibility": 0.95,
      "presence": 0.97
    },
    {
      "id": 25,
      "x": 0.5,
      "y": 0.55,
      "z": -0.1,
      "visibility": 0.95,
      "presence": 0.97
    },
    {
      "id": 26,
      "x": 0.5,
      "y": 0.56,
      "z": -0.1,
      "visibility": 0.95,
      "presence": 0.97
    },
    {
      "id": 27,
      "x": 0.5,
      "y": 0.5700000000000001,
      "z": -0.1,
      "visibility": 0.95,
      "presence": 0.97
    },
    {
      "id": 28,
      "x": 0.5,
      "y": 0.5800000000000001,
      "z": -0.1,
      "visibility": 0.95,
      "presence": 0.97
    },
    {
      "id": 29,
      "x": 0.5,
      "y": 0.59,
      "z": -0.1,
      "visibility": 0.95,
      "presence": 0.97
    },
    {
      "id": 30,
      "x": 0.5,
      "y": 0.6,
      "z": -0.1,
      "visibility": 0.95,
      "presence": 0.97
    },
    {
      "id": 31,
      "x": 0.5,
      "y": 0.61,
      "z": -0.1,
      "visibility": 0.95,
      "presence": 0.97
    },
    {
      "id": 32,
      "x": 0.5,
      "y": 0.62,
      "z": -0.1,
      "visibility": 0.95,
      "presence": 0.97
    }
  ],
  "world_landmarks": [
    {
      "id": 0,
      "x": 0.0,
      "y": -0.5,
      "z": 0.1,
      "confidence": 0.9
    },
    {
      "id": 1,
      "x": 0.0,
      "y": -0.48,
      "z": 0.1,
      "confidence": 0.9
    },
    {
      "id": 2,
      "x": 0.0,
      "y": -0.46,
      "z": 0.1,
      "confidence": 0.9
    },
    {
      "id": 3,
      "x": 0.0,
      "y": -0.44,
      "z": 0.1,
      "confidence": 0.9
    },
    {
      "id": 4,
      "x": 0.0,
      "y": -0.42,
      "z": 0.1,
      "confidence": 0.9
    },
    {
      "id": 5,
      "x": 0.0,
      "y": -0.4,
      "z": 0.1,
      "confidence": 0.9
    },
    {
      "id": 6,
      "x": 0.0,
      "y": -0.38,
      "z": 0.1,
      "confidence": 0.9
    },
    {
      "id": 7,
      "x": 0.0,
      "y": -0.36,
      "z": 0.1,
      "confidence": 0.9
    },
    {
      "id": 8,
      "x": 0.0,
      "y": -0.33999999999999997,
      "z": 0.1,
      "confidence": 0.9
    },
    {
      "id": 9,
      "x": 0.0,
      "y": -0.32,
      "z": 0.1,
      "confidence": 0.9
    },
    {
      "id": 10,
      "x": 0.0,
      "y": -0.3,
      "z": 0.1,
      "confidence": 0.9
    },
    {
      "id": 11,
      "x": 0.0,
      "y": -0.28,
      "z": 0.1,
      "confidence": 0.9
    },
    {
      "id": 12,
      "x": 0.0,
      "y": -0.26,
      "z": 0.1,
      "confidence": 0.9
    },
    {
      "id": 13,
      "x": 0.0,
      "y": -0.24,
      "z": 0.1,
      "confidence": 0.9
    },
    {
      "id": 14,
      "x": 0.0,
      "y": -0.21999999999999997,
      "z": 0.1,
      "confidence": 0.9
    },
    {
      "id": 15,
      "x": 0.0,
      "y": -0.2,
      "z": 0.1,
      "confidence": 0.9
    },
    {
      "id": 16,
      "x": 0.0,
      "y": -0.18,
      "z": 0.1,
      "confidence": 0.9
    },
    {
      "id": 17,
      "x": 0.0,
      "y": -0.15999999999999998,
      "z": 0.1,
      "confidence": 0.9
    },
    {
      "id": 18,
      "x": 0.0,
      "y": -0.14,
      "z": 0.1,
      "confidence": 0.9
    },
    {
      "id": 19,
      "x": 0.0,
      "y": -0.12,
      "z": 0.1,
      "confidence": 0.9
    },
    {
      "id": 20,
      "x": 0.0,
      "y": -0.09999999999999998,
      "z": 0.1,
      "confidence": 0.9
    },
    {
      "id": 21,
      "x": 0.0,
      "y": -0.08000000000000002,
      "z": 0.1,
      "confidence": 0.9
    },
    {
      "id": 22,
      "x": 0.0,
      "y": -0.06,
      "z": 0.1,
      "confidence": 0.9
    },
    {
      "id": 23,
      "x": 0.0,
      "y": -0.03999999999999998,
      "z": 0.1,
      "confidence": 0.9
    },
    {
      "id": 24,
      "x": 0.0,
      "y": -0.020000000000000018,
      "z": 0.1,
      "confidence": 0.9
    },
    {
      "id": 25,
      "x": 0.0,
      "y": 0.0,
      "z": 0.1,
      "confidence": 0.9
    },
    {
      "id": 26,
      "x": 0.0,
      "y": 0.020000000000000018,
      "z": 0.1,
      "confidence": 0.9
    },
    {
      "id": 27,
      "x": 0.0,
      "y": 0.040000000000000036,
      "z": 0.1,
      "confidence": 0.9
    },
    {
      "id": 28,
      "x": 0.0,
      "y": 0.06000000000000005,
      "z": 0.1,
      "confidence": 0.9
    },
    {
      "id": 29,
      "x": 0.0,
      "y": 0.07999999999999996,
      "z": 0.1,
      "confidence": 0.9
    },
    {
      "id": 30,
      "x": 0.0,
      "y": 0.09999999999999998,
      "z": 0.1,
      "confidence": 0.9
    },
    {
      "id": 31,
      "x": 0.0,
      "y": 0.12,
      "z": 0.1,
      "confidence": 0.9
    },
    {
      "id": 32,
      "x": 0.0,
      "y": 0.14,
      "z": 0.1,
      "confidence": 0.9
    }
  ],
  "tracked_subject_id": "track-1",
  "quality": {
    "framing_ok": true,
    "ambiguous_people": false,
    "missing_joints": [],
    "motion_blur": null,
    "person_count": 1,
    "detection_confidence": 0.93,
    "track_changed": false
  },
  "provenance": {
    "model_id": "mediapipe_pose_landmarker",
    "version": "full/0.10.35",
    "delegate": "GPU"
  }
}
